Component-Whole	17	20	Additionally, and particularly in the case of injured or weak knees, means must be provided in the hinge of the knee brace to control the extension of the knee joint and to stop the extension.
Entity-Destination	4	10	Unlike our expectation, this religion is spreading faster into the country.
Content-Container	5	9	When it was ready, my coffee arrived in a mug instead of to go as I had ordered it.
Component-Whole-Inv	19	21	Secondly, the soundboard contributes much more to the timbre underneath the keyboard because it is less obscured by the piano 's framework and hammer mechanism.
Entity-Origin	1	6	The letter was sent from the deathbed of the former KGB spy, Alexander Litvinenko, who died this Saturday after being poisoned with radioactive poison earlier in the month.
Member-Collection-Inv	14	17	Thousands of drummers and dancers perform in the streets of Kandy accompanied by a parade of ornamented elephants.
Cause-Effect	2	8	The metal ball makes a ding ding ding noise when it swings back and hits the metal body of the lamp.
Instrument-Agency-Inv	2	8	The game designer also uses a very specific tool for his work.
Product-Producer	4	8	Goto.com was an Idealab spin-off created by the scientist, and was the first company to successfully provide a pay-for-placement search service.
Other	1	8	The collaboration produced the PUMP(Pittsburg urban mathematics program) curriculum, which focuses on mathematical analyses of real-world situations, the use of computational tools, and on making algebra accessible to all students.
Instrument-Agency-Inv	5	12	During each trial, the first experimenter observed the infant through the small peephole and recorded visual fixations to the left and right stimuli.
Component-Whole-Inv	1	8	"The package includes the BBC ""Fight for Life"" series of videos, which chronicles the difficulties experienced in the lives of women giving birth in developing countries."
Other	4	9	Hence, the left regular grammars generate exactly all regular languages.
Content-Container-Inv	10	13	Because we made observations, we know the fate of the cat in the box.
Cause-Effect	10	14	Natural Liver Cirrhosis Treatment Liver cirrhosis is a degenerative inflammatory disease that results in hardening and scarring of liver cells.
Other	11	14	This daily assault of inflammation in their digestive system, plus the inflammation from your joints and an overworked immune system and excess weight easily exceed the amount of inflammation your body can effectively handle.
Message-Topic-Inv	1	10	Electroconvulsive therapy has been depicted in several fictional and semi-fictional films, books, and songs.
Product-Producer-Inv	1	10	The banker, who has put up in a Sudder Street hotel, told the sleuths that he had entered India on October 20, 2009.
Product-Producer-Inv	24	25	"When a fan of EA's golf game pointed out a flaw that Tiger Woods could play a ""Jesus Shot"" from on water, the game manufacturer's response was this viral featuring the man himself."
Instrument-Agency	1	7	A juicer is a utensil used for squeezing juice from fruit.
Component-Whole	2	8	Rudders and skegs improve the control over your kayak.
Message-Topic	3	10	A variety of articles were written on the topic of alarm management.
Instrument-Agency-Inv	1	6	A programmer uses a high level language to implement its algorithms.
Message-Topic	1	4	The painting shows a burgher portrayed as a benefactor on the steps of his house on the Oude Delft canal.
Member-Collection-Inv	7	9	Far below and a universe away, a constellation of windows darkened.
Cause-Effect-Inv	3	6	The resulting anti-social behaviour from alcohol consumption is an on-going matter that the town and the police continue to address, particularly in the summer months.
Product-Producer-Inv	1	4	The judge put two questions to the jury.
Entity-Origin	6	9	For the locative she includes a photocopy from Collier's encyclopedia under the header Zwickau which has the text dating the city from at least 1471.
Other	1	6	"The police told an open government surveyor it ""doesn't give out the records""."
Cause-Effect-Inv	10	12	The moisturizers' primary function is to keep skin moist, minimize wrinkles from dryness, smoothe and soften skin, and to deliver other ingredients, like sunscreen, that benefit the skin.
Message-Topic	3	6	In this comprehensive guide, over 850 roses are described, illustrated, and arranged by group.
Message-Topic-Inv	1	6	The activities were documented on the newsreels of the day, and form part of a new BBC television series.
Cause-Effect	0	19	 Lesions restricted to the rear portion of the medial part of the precentral gyrus caused a contralateral predominantly distal leg weakness.
Entity-Destination	8	11	I mixed up the ingredients and poured the stuff into the ice cream maker.
Cause-Effect-Inv	5	18	We began to reverse the damage to one of the greatest rivers in the state caused by the construction of a dam nearly 70 years ago.
Cause-Effect-Inv	1	6	The disruption has been caused by work being carried out by track operator Network Rail.
Other	1	7	The plasma was generated by an RF discharge between two parallel electrodes whose diameter was 100 mm and separation was 40 mm using pure silane gas.
Component-Whole-Inv	1	6	The animal is lowered until its pelvic limbs touch the floor or a solid supporting surface.
Other	0	6	 Brutality was an intrinsic part of plantation life and no child, however privileged or protected, could escape its ugliness or it savagery.
Entity-Destination	2	7	Only domestic flights are landing into this airport.
Entity-Origin	1	5	The interference arrives from a direction near endfire since this is the direction where the interelement propagation delay for the interference is largest.
Entity-Destination	3	6	You have added keys into the memory on the remote systems.
Product-Producer-Inv	9	15	The second memorable shift was in September, when the plant made the 75-millionth ton of steel.
Other	7	15	However in addition to Maori, other population groups need specific recognition in the Bill, including people with disabilities.
Other	13	19	The Buffs once again lacked playmakers, the wide receivers couldn't get open, the offense went away from the running game early.
Message-Topic-Inv	0	6	 Details of new contract were under discussion.
Other	2	10	This introductory text makes a threefold contribution to the undergraduate literature.
Other	1	4	Including amenities such as kiosks create pedestrian-friendly spaces.
Content-Container	1	6	The pizza dough was in a bin on the floor.
Other	20	22	When the police raid the catacombs, Shannyn's character hits her head while fleeing only to wake up alone in the maze of skulls and bones.
Entity-Destination	6	10	High test scores have placed the student into a top university.
Member-Collection-Inv	1	3	The gaze of raccoons seemingly form an orderly queue to accept snacks from the bus driver as he stops off outside the Legion of Honor museum in San Francisco.
Component-Whole	1	11	This photograph of an automobile training device was enclosed in a letter to Edwin Link.
Other	1	5	The party has made the crazies into mainstream Republicans.
Entity-Origin-Inv	1	2	With corn starch as its source material, Plantic's plastic is also cost-competitive.
Member-Collection-Inv	3	5	There is a gulp of cormorants that scavenge this stretch of the Sacramento River where I usually kayak.
Other	3	9	The floating zenith telescope has come into formal observatory routine since September.
Entity-Origin	16	21	On entering the water the Esprit's wheels turned inwards to reveal four lateral fins and a periscope popped out of the roof.
Product-Producer-Inv	2	6	The student committee developed the following guidelines.
Component-Whole	5	6	"Most techniques to ""thicken"" the eyebrow hair are actually meant to give the appearance of thicker eyebrows, without really affecting the eyebrow hair growth itself."
Component-Whole-Inv	1	6	The results are often displayed in charts or written as narratives.
Message-Topic	1	8	The section concludes by giving a summary of findings.
Other	1	6	The company moved into the music business.
Other	34	38	In a little time the numbers increased from forty-five to eighty, and soon after to a greater number; which, with the majority of the clergy, and the whole of the national representatives, put the malcontents in a very diminutive condition.
Other	2	5	A remarkable combination of favourable circumstances saw the technology progress from the innovation phase - its trial in prototype form - through to adoption and widespread use, in only a few years.
Message-Topic-Inv	5	10	Philip Collins discusses the apparent decline in rhetoric in a speech given at Radio 3.
Cause-Effect-Inv	21	27	The team prepared GIS precipitation and contour maps of the area (approximately 777 square miles) depicting the landforms and identifying the flooding and landslides caused by the rainfall.
Other	1	5	The system combined the hierarchical structure of decision trees with a clean probabilistic semantics.
Entity-Origin	1	7	The sword was taken from his small hands, and placed back in its place on the wall.
Other	9	11	It also includes an automatic purge valve for quick equalization after changes in atmospheric pressure.
Member-Collection-Inv	18	21	Just 18 months ago, the New York Times Magazine ran a cover story depicting progressive bloggers as a band of unkempt outsiders.
Entity-Destination	1	6	Global oil prolongation is approaching its peak.
Content-Container-Inv	8	10	In Japan I was able to bring a bottle with water in it through security on my way to Singapore.
Component-Whole	4	7	Usually only the bottom lid of one eye is involved, but the top eyelid also can twitch.
Component-Whole-Inv	1	7	The programme begins with the UWI Venture competition which is opened to final year undergraduate students, graduate students and researchers at the UWI.
Other	10	13	The citizens remained in their houses, and only vagabonds, the scum of various nationalities, and spies were about; women were not to be seen, or only such as belonged to the dregs of society.
Member-Collection-Inv	7	9	Congenital renal disease was detected in a flock of sheep in the English Midlands over 2 successive years (1982 and 1983).
Message-Topic	2	6	The current debate swirling around Leather's comments seems to suggest both.
Other	10	15	By charging odd amounts like 49 or 99 cents, the cashier very probably opened the till.
Product-Producer-Inv	1	5	The company uses a policy assertion to convey a condition under which they offer a Web service.
Instrument-Agency	4	5	OSHA regulates that a forklift operator's training program have three parts.
Message-Topic	5	8	UK researchers have offered new insight into the origins of RNA.
Component-Whole-Inv	2	3	The ride-on boat tiller was developed by engineers Arnold S. Juliano and Dr. Eulito U. Bautista.
Component-Whole	13	16	We pulled the engine out to fix the main oil gasket on the crank of the engine.
Other	1	4	Congregational clergy of various denominations were surveyed to assess their understanding and experience of trauma.
Member-Collection-Inv	32	34	The story of the epic struggle between the Islamic Empire of the Ottomans and the Christian Kingdoms of Eastern Europe is told from the perspective of a secret fraternity, the Excubitors, a brotherhood of counselors to kings, sultans, head of churches, knights, scholars, financiers, and merchant adventurers who hold influential positions on both sides of the conflict.
Product-Producer-Inv	8	11	In the first year of King Cyrus, the king issued a decree.
Member-Collection	7	10	During this period of time, when a soldier joins the army, he has to buy his own war horse and weapons.
Product-Producer-Inv	3	7	However, the two brothers created the Glagolithic alphabet; it was their disciple Saint Climent who invented the simpler Cyrillic alphabet and named it in honor of his teacher.
Message-Topic	11	14	The Commission submitted to the Council and the European Parliament a report on the application and conditions of implementation of the Agreement.
Other	5	9	It is a branch of philosophy dealing with the nature of beauty, art, and taste, and with the creation and appreciation of beauty.
Message-Topic	4	9	The focus of any course is, however, art therapy theory.
Entity-Destination	8	11	I took everything out and immediately placed the phone in the cradle to charge the battery.
Message-Topic	3	9	It contains a chapter giving an introduction to compression algorithms.
Product-Producer	4	10	Under a giant silk cocoon created by an army of caterpillars, the shape of a Honda is just about visible.
Entity-Destination	13	17	Many investors' funds are pooled together and the fund managers invest all the money in a diversified basket of investments.
Other	6	10	The concert closes with the young composer's take on another aria from Guilio Cesare, the notoriously tricky Al lampo dell'armi.
Content-Container	1	6	The bag was stored in a sack.
Component-Whole	1	4	The handle of the stick was covered with plastic material for more durability (Figure - 3).
Component-Whole	1	5	The executive board of this company reported on its activities and answered questions from the audience.
Other	9	11	Warm weather is here, and with it comes the scourge of mosquitoes.
Message-Topic	3	6	This famous Chinese fable describes a fox, who visits chickens and brings presents.
Component-Whole	12	18	The mobile crane can be used for demolition or earthmoving as the hook at the end of the crane can be changed to a ball or wrecking bucket, dependent on the crane hire job.
Instrument-Agency-Inv	1	8	The guy cleaned the heads with a cotton swab soaked in flushing fluid, changed the pad, and then ran a head clean, the results were amazing.
Product-Producer	1	6	The vaccine is produced by the government and is not for sale to private individuals or companies.
Member-Collection-Inv	4	5	He has been a jury member at four Olympic Games, and Chairman in 2004 and 2008.
Content-Container-Inv	2	10	The remaining contents of the package included four ounces of plastique filled with tiny metallic slivers.
Content-Container	1	8	The handgun was discovered inside a sealed Velcro pocket on the front driver's seat.
Cause-Effect-Inv	1	5	The problem comes from the widgets resembling HTC's own Sense UI widgets.
Entity-Destination	1	9	The baby bat was blown into the squirrel's treetop nest by a storm.
Entity-Destination	2	6	The elderly immigrants flow into warmer states such as California and Florida.
Component-Whole-Inv	3	11	The wastewater treatment plant processes the influent using a ultra-violet light system to kill the bacteria prior to outflow.
Cause-Effect	1	5	The earthquake caused a bulrush marsh at West Point, on the Puget Sound shore in Seattle, to drop and the tsunami deposited sand on top of the marsh.
Entity-Destination	5	11	At the moment heavy snow showers are running into the Northeastern regions of England.
Component-Whole	2	5	Alexandros caught blade by the haft as it fell.
Member-Collection-Inv	16	19	We evaluated the application of these guidelines, focusing on the opinions and experience of the global community of national assessors.
Entity-Origin	21	25	He was beginning to think he'd better find something else to do with his life when out of the blue a telegram arrived from an executive at IBM.
Cause-Effect	1	8	The charge is the source of an electric field, which carries energy-the electrostatic self-energy.
Entity-Origin	1	7	A man who leapt from a brothel window during an immigration raid filmed for reality television later died.
Component-Whole	1	4	The rope of the prayer-bell was there in a perfect state and coiled up.
Cause-Effect	1	8	The outbreak resulted in 256 deaths and 3,402 injuries.
Component-Whole	11	19	In a similar context, this circuit has followed the rule that reinstatement is a basic element of the appropriate remedy in wrongful employee discharge cases.
Other	8	12	My cousins have some fun sliding down the steps in a laundry basket.
Entity-Origin	0	5	 Biodiesel is derived from vegetable oils.
Cause-Effect-Inv	12	16	Wes Anderson has made one classic comedy(The Royal Tenenbaums) fueled by the tension from the characters' longings to burst out of the trappings in which they are framed.
Component-Whole	6	9	They looked very closely at the white of the eye, and saw lines that look like tiny pink threads.
Content-Container	1	6	The prescription bottle was inside a plastic pouch along with the Newport cigarette box containing one of the crack pipes.
Message-Topic	2	5	The final chapter offers a theological survey of the use of the formula.
Product-Producer-Inv	4	14	Caryn James, a film critic for The New York Times, has just completed a novel.
Product-Producer-Inv	2	7	The wrathful goddess turned her into a crane and proclaimed that her bird descendants should wage eternal war on the Pygmy folk.
Content-Container-Inv	4	7	I always carry a suitcase with my clothes in it.
Product-Producer	9	13	The photomask is usually prepared with a photoplotter from data produced by a technician using CAM, or computer-aided manufacturing software.
Content-Container	15	21	Then I swept up the dust, which looked like sawdust, and put it in a plastic container, which was in a cabinet under the granite counter top.
Message-Topic	5	9	Fact Magazine was an American publication that commented on controversial topics.
Product-Producer-Inv	2	4	The Canadian author's sixth book is a domestic tragicomedy about love, alcoholism and failed families.
Member-Collection-Inv	17	20	I went with a few friends up to the sky pool bar area, proceeded to order a round of cocktail drinks and had to wait a considerable amount of time for them.
Message-Topic	3	9	The focus of study is on psychological or mental mechanisms, also referred to as decision processes, information processes, or Darwinian algorithms.
Cause-Effect	0	8	 Immigrants accounted for more than half of Britain's population growth in recent years.
Instrument-Agency-Inv	9	13	The fascinating aspect of therapeutic riding is that the rider sitting astride a horse walking establishes what is a perfect walking gait for the human.
Content-Container	27	30	It is inherently no less silly to see a king in a pear (as all of France did) than to see a pear in a rabbit, a rabbit in a carafe, a carafe in a clock, and so on and so forth.
Other	1	7	His wife is a participant in the blogosphere, and he doesn't want to ruin the surprise for her.
Content-Container	1	5	The dress was in a trunk dated summer of 1938 along with several other dresses from this same period.
Other	2	4	He's stuffed pork into defense and homeland security.
Component-Whole	7	10	Formerly it was usual to insulate the rod of the electroscope by passing it through a hole in a cork or mass of sulphur fixed in the top of the glass vessel within which the gold leaves were suspended.
Entity-Origin	3	6	I also incorporate meteorites from outer space and dinosaur bones.
Other	6	11	He went on to examine the theory from a risk assessment perspective.
Component-Whole	15	18	Another known connector uses the center conductor of the coaxial cable to push out the pin of the connector.
Product-Producer-Inv	1	10	The media then creates a self fulfilling prophesy with constant reports of doom and gloom and individuals also pull their money out of the targeted bank.
Other	2	5	The hand-cranked churn produced smoother ice cream than the pot freezer and did it quicker.
Content-Container	2	8	A sluggish cat named Minnie sleeps in a scuttle beside the stove.
Cause-Effect	1	4	These tests establish baseline information on employees and help insure that they are appropriately matched to the physical demands of their jobs.
Component-Whole-Inv	20	23	Mixing the best spirit of punk with a rock musician's technical ability, the 36 minutes blur past in a furious menage of soloing guitars, crunching rhythm and fantastic lead vocals.
Entity-Origin-Inv	7	8	The taste, however, is mild, and like rice liquor gone right.
Component-Whole-Inv	1	5	The mansion has a small museum with exhibits linked to the building's history, including antique Singer sewing machines.
Component-Whole	6	9	I pulled the bags over the rim of the bucket and pulled the cord to tighten it.
Entity-Destination	1	5	The jobs migrated into the government.
Member-Collection-Inv	17	20	All of their products are the direct result of extensive research and development and produce a varied array of spectral colors, enabling you to sound your best.
Component-Whole-Inv	3	5	The majority of tree feeder roots are located in the top four to eight inches of soil.
Other	10	13	In order to gather experimental data, researchers explicitly defined a model describing the process.
Message-Topic-Inv	5	9	Throughout the series run, the character has received positive reviews.
Component-Whole	2	5	The three fireplaces in the cottage are constructed of random stones with mortar joints raised and rounded.
Content-Container	1	4	When water in a kettle becomes acidic due to decomposing organic plant matter, it becomes a kettle bog or kettle peatland.
Cause-Effect-Inv	1	6	Genuine joy comes from profound spiritual awareness on life and an absolute clarity of direction, living for a purpose.
Cause-Effect-Inv	3	8	Excluding the current outbreaks caused by the H5N1 virus, only 24 outbreaks of highly pathogenic avian influenza have been recorded worldwide since 1959.
Instrument-Agency-Inv	3	6	Many of the passengers took the shuttle to town and turned around in ten minutes retreating back to the comfort of the air-conditioned ship.
Entity-Origin-Inv	6	7	A nice, big bowl of homemade vegetable soup is one of the best ways to get a lot of the veggies you need all in one dish.
Other	5	13	The chronic myelogenous leukemia-specific P210 protein is the product of the bcr/abl hybrid gene.
Cause-Effect-Inv	0	5	 Unemployment has been caused by people who either knowingly or unknowingly have priced people out of jobs.
Content-Container	1	7	The wine was stored in a wine rack so the cork has been wet to prevent the wine from turning to vinegar.
Content-Container	11	16	Inside the car, keys were found in the ignition and Codario-Ferrino's license was discovered inside a purse on the passenger's seat.
Other	26	31	He went up to Oxford during the war to read English and, after war service in India, codirected The Tempest with Neville Coghill in an outdoor production by the Worcester College lake.
Message-Topic	4	8	Some of these conspiracy theories allege that his birth certificate is a forgery.
Entity-Origin	1	8	The power to rule is derived from a mandate of the masses.
Product-Producer	14	19	"Next we stopped by a pine table where an arrangement of cobalt blue ""knitted"" bowls by a South African ceramicist complemented a neat stack of chic indigo denim trousers by London's Made in Heaven."
Entity-Origin-Inv	12	13	Rabbi was cured of a severe disorder of the bowels by drinking apple wine seventy years old, a Gentile having stored away 300 casks of it ('Ab. Zarah 40b).
Content-Container-Inv	9	11	We dissolved the contents of one packet in a carafe of water and ran the brew cycle.
Component-Whole	16	21	The stabilising effects on the glenohumeral joint of each of the rotator-cuff muscles and of the biceps were studied with the arm in abduction and external rotation in 13 cadaver shoulders.
Other	2	7	The punk explosion cultivated the underground/indie rock scene that would one day be called 'alternative music'.
Cause-Effect-Inv	13	17	That year, summer students at the VLA made the first discovery of radio emission from a brown dwarf.
Component-Whole-Inv	5	8	The front of the boring machine contains tungsten-tipped picks that workers guide with the use of laser projections on video screens.
Instrument-Agency-Inv	2	10	The motor system scaled the object's dimensions by modulating the muscles.
Message-Topic	4	16	There was also some argumentation between the co-pilot and the pilot and captain relating with the speed and flaps.
Other	1	10	The strategy covers the period to 2016, with a strong focus on 2010.
Entity-Destination	3	5	Voters passed on messages to members of the Congress by email.
Member-Collection	6	7	At that time, it issued a card deck in the hopes of paving the way to regime change and, eventually, large-scale war crimes proceedings.
Content-Container	15	19	The goal of the study was to determine the percentage of adult Americans who keep money in a regular savings account.
Cause-Effect-Inv	12	15	We continue to see progress toward a world free of the daily terror of antipersonnel landmines.
Cause-Effect	1	5	Frustrations, threats, and conflicts cause stress.
Other	1	9	A mason has removed the original left and right edges and in their place has prepared a simple moulding on each side.
Other	0	3	 Discovery consists of seeing what everybody else has seen and thinking what nobody else has thought.
Entity-Destination	1	8	One tablet per quart was dropped into a canteen and made the water safe to drink.
Other	1	4	The lawnmower cuts a swath of grass as it moves across the lawn.
Member-Collection-Inv	1	3	A string of pack-ponies trotted through the pines behind them.
Member-Collection-Inv	6	8	Players are tasked with building an armada of ships and a base from which to deploy them.
Message-Topic	8	13	While the slide was presented, an audio-recorded biographical script was played describing the person.
Member-Collection-Inv	15	18	Her shallow waters seethe at times, standing tall and swaying back and forth like a quiver of king cobras.
Other	1	7	Statistical analysis was made using the PCSM program.
Cause-Effect-Inv	2	9	Citing the conflict of interest created by the ethics charges, Nifong asked the state attorney general's office to take over the lacrosse case.
Product-Producer	0	8	 Insulin is a hormone naturally produced by the pancreas.
Product-Producer-Inv	1	5	The sculptor has carved a statue of Brad Pitt and Angelina Jolie, naked and embracing one another and placed it inside an Oklahoma City home.
