Cause-Effect	1	5	The crashes resulted in the collapse of much of the World Trade Center complex, the destruction of part of the southwest side of the Pentagon.
Message-Topic	4	7	The exhibition comprises original drawings featuring famous landmarks between Plymouth and London.
Content-Container-Inv	7	10	He carried with him an old wicker basket containing stale biscuits, some cured ham, and a bottle full of goat's milk.
Other	3	6	This is wishful thinking by a scribe who is more blind to the reality than those he accuses of blindness.
Content-Container	1	5	My soda came in a can.
Instrument-Agency-Inv	0	4	 Judges wear the bench wig when they are sitting in court.
Entity-Destination	3	6	My friend puts tea in a thermos to take to work.
Member-Collection-Inv	10	13	For 25 years, Christmas in New Bern has included a flotilla of decorated boats gliding along the confluence of the Neuse and Trent rivers at Union Point Park.
Component-Whole-Inv	1	4	Our microwave has a button for popcorn.
Entity-Destination	5	8	The second dancer has added rhythm into his dance.
Instrument-Agency-Inv	1	10	The patient literally sawed it in half using a hard toothbrush over a period of many years.
Entity-Origin	9	15	From the diagrams of DaVinci to the latest photographic marvels retrieved from the remotest galactic outback, visualization of research has a long and literally illustrious history.
Member-Collection-Inv	8	11	I'm still having a hard time imagining a smuck of glowing jellyfish 10x10 miles and 35 feet deep.
Product-Producer	11	14	The three prints are a great example of a rare vintage photograph by an artist who had an influence on later 20th-century photographers.
Message-Topic-Inv	8	14	First, a comprehensive literature review was conducted and results were presented in the previous chapter.
Other	16	17	Monica Mullikin ('00) is working for Willis of Minneapolis as a catastrophe risk analyst for this reinsurance company.
Instrument-Agency-Inv	8	9	The index finger was placed inside a normal outfielder's glove, but it seemed placed at an angle where it has a difficult time assisting in the closing of the glove around the ball.
Cause-Effect	1	6	The tsunami resulted in significant property damage but only two fatalities in RS.
Other	1	6	The architect carefully designed the 15 rowhouses, reflecting the suburban ideal of the late 1800s.
Product-Producer-Inv	2	6	The first mathematician derived the new formula for the sum of the fourth power using a method that is readily general for determining the general formula for the sum of any integral powers.
Entity-Destination	7	12	They cremated their dead and placed the ashes in a specially prepared pit.
Content-Container-Inv	1	4	A suitcase with his things in it was on the doorstep.
Instrument-Agency-Inv	7	10	Originally, the typewriter sales companies sold the typist with the typewriter.
Entity-Destination	1	7	The items are handed over into our trust.
Other	1	6	A professor portrays his students' term paper as his own.
Entity-Origin-Inv	9	10	The French Toast was very tasty and the mango cranberry syrup was a nice touch.
Product-Producer-Inv	21	28	Mark Coreth, 48, a troop leader with 4 Troop, B Squadron The Blues and Royals during the conflict, and now a sculptor who has recently completed a memorial work featuring three flying albatrosses, spoke after the service.
Component-Whole	1	8	This document is part of the WHO information series on school health.
Other	1	10	The removal duplicate songs is done with the user-friendly start-up wizard.
Product-Producer-Inv	5	17	Sam Houghton, a five-year old boy from Buxton, Derbyshire, patented an invention after coming up with an idea for a labour-saving broom to help his father sweep up leaves.
Component-Whole-Inv	3	9	The Agenda 21 document, agreed in Rio, includes a section on international co-operation.
Cause-Effect-Inv	16	22	The hidden preamble or timing signal is employed to mark the time of commencement of the transmission of information pulses from a transmitter.
Product-Producer-Inv	1	14	The girl, in her first holiday season as an Elm Creek Quilter, creates a quilt for her best friend even as she begins to question her feelings for him.
Entity-Destination	1	7	Your upload has been added to the system.
Instrument-Agency-Inv	1	10	A client copes with replica failures using a simple retransmission mechanism.
Product-Producer-Inv	8	9	He had attended Vollenhoven's lectures and read the philosopher's books, much of them available for years in mimeo editions in Dutch.
Entity-Destination	1	6	The sacrifices were thrown into the volcano.
Entity-Destination	6	8	Such cosmic impacts also have spread life to alien worlds.
Entity-Destination	0	10	 Equipment for making repairs en route was carried in a jockey box attached to one end or side of the wagon.
Component-Whole-Inv	1	4	The award comprises a trophy and a certificate and is being run by The British Cartographic Society with the support of Stanfords Map Shop.
Member-Collection	11	17	The Corel data set is relatively simple because the annotations are nouns selected from a relatively small vocabulary.
Message-Topic-Inv	5	12	It was noted that this policy had been considered at the last meeting of the Policy and Procedure Review.
Member-Collection	3	12	In recent years, opinions on classical drive theory have fallen into contending groups.
Message-Topic	5	8	There are many theories and thoughts about the effects of the moon on people, animals, and the natural world.
Message-Topic	7	11	Young people from Bridgend made this animated film to highlight the dangers of forest fires.
Product-Producer-Inv	8	13	Common ravens are one of only a few species who make their own toys.
Other	4	9	After mile 17 the course went away from the water and onto streets with trees.
Content-Container	2	8	"The green suitcase was inside a larger tan suitcase, which also contained a set of baby rosary beads, a religious picture, a picture of a 5-year-old girl and a card that read ""Birthday Prayer""."
Member-Collection-Inv	12	15	This painting depicts a swooping falcon with its claws bared pursuing a host of nine sparrows in frightened flight, the two forming an energetic arc enriched by the lifted right wing of the falcon and the panicked sparrows dispersed in all directions.
Message-Topic	5	10	This is facilitated through regular colloquia on the subject of language and society, as well as through a diverse curriculum of courses offered toward the CLASP Graduate Certificate.
Entity-Destination	1	5	The pieces are falling into place.
Component-Whole	16	19	The user holded the handle with one hand and used the other hand to rotate the crank of the fishing reel.
Component-Whole	1	4	The pouches of female wallabies, like those of other macropods, are front-opening.
Content-Container	3	7	The credit card-sized reader sits in my wallet, so that I can carry it with myself wherever I go.
Component-Whole-Inv	4	7	These slippers have a double sole with padding inside.
Message-Topic	1	9	A meeting called by India's government to discuss the creation of a separate state in the tea-producing Darjeeling hills has ended without a breakthrough.
Entity-Destination	1	5	Our ancestors journeyed into an unknown world to find food.
Instrument-Agency	8	10	Without doubt, this is one of the best books for artists available.
Message-Topic	16	20	GolTV's unique offering positions it in the highly competitive US media market as the only TV channel devoted exclusively to soccer.
Cause-Effect-Inv	1	8	The colouration has been caused by a blue dye.
Component-Whole-Inv	1	11	That car had a number of GPS sensors and lasers, a camera, and other equipment to help it make its way through the course.
Message-Topic	2	6	The presented case study charts the route taken by North Kesteven.
Cause-Effect-Inv	12	15	The risks of this procedure include anesthesia complications, post-operative difficulty breathing, and sore throat from intubation.
Product-Producer	15	16	There are a few simple steps you take to ensure you have selected the correct landscape company.
Message-Topic	6	12	Uncle Jay occasionally does a one-off special, dedicated to explaining a specific term or issue.
Entity-Origin	2	8	The above ticker was distilled from my daily posts to Twitter.
Other	5	9	Since then, numerous independent feature directors have journeyed into series television.
Message-Topic	1	5	The study report compares the genetic structure of two vastly different flowering plants to see whether differences exist in the set of circuits that create each species' flower.
Cause-Effect	1	5	The killings resulted in indiscriminate firing by unknown people in Garden area of the city.
Product-Producer-Inv	2	5	The steering committee developed the protocol and consent forms with the participating sites and guided the implementation of the trial.
Message-Topic	2	6	The latter course explained the biological phenomena in a mathematical way.
Other	15	18	The European Ombudsman, P. Nikiforos Diamandouros, has asked the European Commission to correct an administrative error concerning fishing quotas in the West of Scotland.
Product-Producer-Inv	9	14	A brewer from Southwick is immortalised as a Hampshire farmer produces a new real ale in celebration of Old Dick.
Product-Producer-Inv	8	11	Toda has established himself as the world's foremost folder of paper planes.
Entity-Origin	1	5	The demonstrators descended from the vehicles and marched five kilometers.
Cause-Effect	1	14	This smile, a true reflection of God's tenderness, is the source of an invincible hope.
Cause-Effect-Inv	10	16	Occasionally, a dream proffers no solution but portrays only the anxiety which is generated by the conflict.
Entity-Destination	10	15	With the Ramps and platform for off-ground vehicle washing, used water is collected in a receptacle below platform.
Product-Producer-Inv	4	8	They really saw the architect's expensively produced Dongtan masterplan as a blueprint for a more sustainable future.
Other	5	6	Learning to change your vehicle's engine oil saves you time and money.
Content-Container	2	6	Each person's name was in a box.
Product-Producer	2	16	A critical habitat for beluga whales in upper Cook Inlet has been created by the federal government.
Cause-Effect	20	24	Thus, evaluating capital punishment as a form of retribution is reduced by Sellin to merely estimating the proportion of capital murders that result in execution.
Entity-Destination	3	6	This activity spreads disease to our dogs.
Content-Container	1	5	A weapon was inside a wooden box behind a stereo cabinet that was suspended about seven feet above the floor.
Entity-Destination	2	7	The new model is moving into new territory with revisions.
Component-Whole	12	15	Side play of the spindle is prevented in one direction by the crank of the handle, and in other directions by a piece of brass tube.
Member-Collection-Inv	16	18	Officials in the Northern Chinese province of Inner Mongolia have mobilized 33,000 people to stop a swarm of locusts 267 miles outside of Beijing.
Content-Container	4	8	The first mass marketed toothpaste was in a jar from Colgate with the tubes we know today coming into existence in 1896.
Message-Topic	9	11	A penal code is a portion of a state's laws defining crimes and specifying the punishment.
Content-Container-Inv	1	8	A basket such as you mention holds four ears of corn.
Message-Topic	1	13	A war of words erupts between Sinn Fein and the DUP over the devolution of policing and justice powers to Northern Ireland.
Message-Topic	3	7	Both novel and film insist upon the necessity of the past in defining who we are and how we will live in the present.
Other	3	8	I took this photo out of an airplane window.
Other	7	10	His new research shows that the tree trunks in the forest act like hot water bottles.
Member-Collection-Inv	12	15	In particular, the main target of the bombing in Tigray was the network of rural markets in TPLF-controlled areas.
Cause-Effect-Inv	1	5	Cervical cancer is caused by infection with the human papillomavirus (HPV) and is one of the most common cancers in women in developing countries.
Component-Whole-Inv	5	8	At the entrance to the farm is the gardenhouse, the heart of the community Supported garden at Genesis Farm.
Entity-Origin	3	11	Some of the movies got kicked out from the most recent list.
Other	1	6	His scepticism in regard to the liberal reforms of the sixties made him very unpopular among the more progressive writers of that time.
Product-Producer	4	7	This is a disturbing remark from the author which indicates just how arrogant and distant the police have become.
Other	6	8	The trio, the penguins, and a cartload of chimpanzees use the newly-fixed plane (which looks more like a helicopter) to come to the rescue.
Member-Collection-Inv	17	20	This is a bunch of comics from Act-I-Vate, which, if I'm understanding the intro correctly, is a cabal of comix artists who hang out on Livejournal.
Instrument-Agency-Inv	1	8	The teacher covers the candle with a tall glass.
Cause-Effect-Inv	8	15	It took a long time to undo the damage that has been caused by the crisis of confidence, damage whose effects are just now beginning to make themselves felt in a slow, glacial collapse.
Message-Topic	1	4	The film portrays four girls in a trend-setting clique at a fictional Ohio high school.
Entity-Origin	1	10	"Another celebrity has bailed out of the Costa Rican jungle set of ""I'm a Celebrity... Get Me Out of Here!"
Instrument-Agency	1	4	The stethoscope gives the doctor clues as to the presence or absence of pathology.
Content-Container	1	6	The mah-jongg set was in a trunk in the attic all through my childhood, then the trunk was in the garage for ten years.
Instrument-Agency-Inv	6	14	LC repair is a special welding system that employs a high power YaG laser beam.
Message-Topic	4	9	Here, in exclusive interview clips, he talked about his career and what he thought of today's television.
Entity-Destination	2	6	Accidentally, the electricity flew into the water on the ground.
Member-Collection-Inv	24	27	In the film, Howell plays a cop who gets involved with a murder witness, only to find out that she's part of an international ring of sex-for-hire beauties.
Entity-Destination	8	13	The heart of the system is an air-tight membrane initially spooled inside a canister.
Entity-Destination	1	5	The phone went into the washer.
Product-Producer-Inv	1	12	The reporters on this project have constructed one of the most comprehensive explanations of how the price of this vital infrastructure has spiraled out of control.
Entity-Destination	1	7	Another message is being delivered to another mail application.
Entity-Destination	0	5	 Flowers are carried into the chapel.
Entity-Destination	1	9	All items including photos have been dragged into a garbage bin.
Component-Whole-Inv	2	6	This amazing machine contained a shift register made out of a motor and a rotor as well as a keyboard ROM consisting solely of levers and springs.
Other	6	8	I really got into using baking soda for cleaning, so I buy it in bulk.
Cause-Effect-Inv	7	12	Space shuttle science shows how 1908 Tunguska explosion was caused by a comet.
Content-Container	1	5	The message was inside a box of Post Toasties.
Product-Producer	1	5	The batteries developed by the team from Tel Aviv University (TAU) work in a different way than conventional batteries.
Other	1	8	Other stations (and cable channels) have spawned imitation shows.
Instrument-Agency-Inv	2	7	Currently, the villagers operate a ram oil press that is counter-intuitive to use and leads to sub-optimal oil extraction from groundnuts.
Entity-Origin-Inv	6	7	In many ways, the flavor of rye beer is reminiscent of wheat beers.
Member-Collection-Inv	8	11	It is a shady retreat, close to a chain of shallow ponds near the lake shore.
Other	3	5	Texas prepares for crush of executions.
Product-Producer	2	5	That ominous message from the chairman has been followed up this afternoon with the departure of manager Russell Slade.
Entity-Destination	4	7	The company shipped the cargo to the factory in China.
Member-Collection-Inv	7	9	That looked like an equally impenetrable city jungle of wagons, horses, small tents, and humanity.
Cause-Effect-Inv	1	8	The echoing you see is from an expect command running after send has run.
Other	2	5	We take multivitamin that contains vitamins D, E, K, and beta-carotene.
Component-Whole-Inv	7	8	I have recently developed creases in my ear lobes.
Entity-Destination	6	12	As the winter is coming, the virus is rapidly spreading into young children and elderly people.
Member-Collection	26	29	Anderson is regarded as one of the most able and articulate members of Congress, but he has a voting record that is anathema to most other congressmen in his party.
Entity-Destination	0	3	 Money flows into hedge funds again.
Entity-Destination	6	10	The social worker has placed the girl into the loving family of a lawyer.
Member-Collection	1	5	A deputy from Albania's ruling party assaulted a Balkan Insight editor when he was grilled over a fake law degree.
Other	5	9	His tendency to experience pathological anxiety from his early years and his tendency to respond to novelty, change, and challenges with an exaggerated anxiety response were noted.
Cause-Effect-Inv	11	15	The recovery is weak and fragile, and the economic and social damage caused by the crisis is long-lasting.
Component-Whole-Inv	7	8	I used these techniques to stretch my ear lobes to accept 6 gauge earrings.
Entity-Destination	1	7	The surfer is dropped into a 35-foot wave at Waimea Bay.
Component-Whole	2	7	A witness statement contains the witness's factual account of the circumstances of the dispute.
Instrument-Agency	1	4	A telescope assists the eye chiefly in two ways.
Member-Collection-Inv	10	12	Most business that think they have teams really have a horde of heroes looking for plunder.
Product-Producer	0	2	 Burrows by birds are usually made in soft soils; some penguins and other pelagic seabirds are noted for such burrows.
Content-Container	2	8	The ovarian tumour was put inside a plastic bag before retrieval.
Other	0	3	 People harvest the seeds, macerate them, and roll them into thick sticks of dry, hardened paste which can then be stored or exported from the region.
Member-Collection-Inv	3	5	Kurosawa hired a legion of marksmen to fire arrows at his lead actor.
Component-Whole-Inv	5	8	It was a whole flying wedge of white swans flying over Wall Street marking the market in their own charming way.
Other	1	5	The container encloses a one-cup capacity, plus with the bonus lid it provides convenient storage of chopped foods.
Cause-Effect-Inv	2	4	Phobia like fear from crowd, fear from insects, fear from height etc all contribute in developing the anxiety disorder.
Entity-Destination	3	5	The town poured money into schools, streetscapes and new buildings for city services.
Other	11	12	Rice University and Houston-based MI SWACO, the world's largest producer of drilling fluids for the petrochemical industry, aim to develop a graphene additive.
Other	9	13	A rasher of bacon was found in a returned book by a Worthing librarian.
Message-Topic	4	11	The aim of this paper is to present some recent experimental results obtained in Rayleigh-Benard instability.
Entity-Origin	3	8	Surprisingly soon, a culprit popped out of the data.
Component-Whole	6	9	One of the guards at the entrance of the supermarket said it had been the same scenario on Saturday with a long queue for sugar being the order of the day.
Message-Topic-Inv	2	9	This public debate has been reflected in widely advertised series in the popular magazines and by numerous analysts.
Product-Producer-Inv	2	6	The record holder folded his 10cm aircraft by hand from a single sheet of paper and did not use scissors or glue.
Product-Producer-Inv	1	8	The writer has dropped the quotation into the paragraph without making any connection between it and the claim.
Product-Producer	14	19	The invisible hand, also known as the invisible hand of the market, is a metaphor first coined by the economist in The Theory of Moral Sentiments.
Other	8	13	At the end of a long day, the teacher relaxed with a short nap on her sofa.
Other	15	18	State abandoned national socio-cultural imperatives and rushed in to join the scandalous community and the camaraderie of the tyrants.
Product-Producer-Inv	2	6	Next the soldiers put up a wall of stakes on the pile of dirt.
Component-Whole	1	4	The glomeruli assist the kidneys in filtering urine from the blood.
Component-Whole-Inv	6	14	"About two months later, the baby alligator breaks open the egg with a sharp pick on the end of the nose called an ""egg tooth""."
Component-Whole-Inv	2	20	This extensor mechanism is composed chiefly of the quadriceps femoris (rectus femoris, vastus lateralis, vastus intermedius, vastus medialis), quadriceps tendon, patella, and patellar tendon.
Member-Collection-Inv	25	27	Hedgehogs annoy only their political opposition, while foxes annoy across the political spectrum, in part because the smartest foxes cherry-pick idea fragments from the whole array of hedgehogs.
Cause-Effect	1	7	The death of the rat caused the relocation of the flea, and if its next host just happened to be a human, then contagion was the result.
Component-Whole-Inv	5	6	A tent assembly includes a tent frame, a top support frame mounted on top of the tent frame, and an umbrella frame connected to the top support frame.
Entity-Origin	10	14	"Referred to as ""The Other White Meat,"" Pork is a meat originating from the pig that comes in a variety of cuts, and can be cooked almost any way."
Cause-Effect	8	10	American skiier Lindsey Vonn denied downhill treble as fog caused cancellation in Val d'Isere.
Entity-Origin	1	7	The bridge was moved from its original location in an effort to save it.
Product-Producer-Inv	4	7	Besieged by questions, the girl started a blog to defend herself, and to capitalise on her newfound fame.
Cause-Effect-Inv	7	13	Hepatitis B is a potentially life-threatening liver infection caused by the hepatitis B virus.
Message-Topic-Inv	1	7	The government was criticised in a radio debate.
Content-Container	1	9	The body of Sandra Cantu was discovered inside a suitcase in an irrigation pond.
Cause-Effect-Inv	0	3	 Entrepreneurship out of necessity is quite common in Europe where 60% of female headed businesses in Northern Europe and 70% in Southern Europe are established for this reason.
Other	3	7	22 traditional dancing ensembles participated in the festival of Razlog.
Entity-Destination	1	8	The paleogene horizons have migrated into the upthrown basement blocks from adjacent sedimentary horizons.
Component-Whole	7	10	Varicose veins result from weakening of the valves of the veins so that blood pools in the legs or another dependent area.
Component-Whole-Inv	1	4	The system uses a filter to clean the air that the central vacuum has taken in.
Product-Producer	5	8	This is another great new wheeze from the people who got rid of News at Ten in the first place (and then ended up bringing it back).
Cause-Effect	2	6	The continuous rains had caused the overflow of Sulangaling River, a creek of the Muara Batang.
Message-Topic-Inv	0	7	 Garbage is rapidly becoming the topic of discussion in business meetings, political conventions, and even at the dinner table.
Product-Producer	8	11	BMW or Bavarian Motor Works is a German car and motorcycle manufacturer.
Cause-Effect-Inv	11	16	Mixed in equal parts with peppermint, Elder flowers help reduce the fevers and aches caused by colds and the flu.
Entity-Origin	10	13	Just like consulting a cookbook, starting out by using a recipe from a book or website is great.
Message-Topic	1	4	The conversation centers around privacy, contextualization and other issues surrounding our increasingly digital lives.
Instrument-Agency	6	8	TextMate is hailed as the best editor for programmers by many people.
Cause-Effect	1	6	The accident caused a major traffic snarl on the arterial road.
Member-Collection-Inv	13	17	The influence of hole shape on extraordinary optical transmission was investigated using hole arrays consisting of rectangular holes with different aspect ratios.
Product-Producer-Inv	2	5	Normally, the bone marrow produces stem cells (immature cells) that develop into mature blood cells.
Message-Topic	2	8	Meanwhile, the speech pointed out that the scientific innovation is the only way to develop.
Instrument-Agency-Inv	1	3	The artist's development toolkit is one of a series of interactive artist's tookits.
Component-Whole-Inv	3	4	She lost a propellor blade going through the Bay of Biscay and was taken in tow arriving Gibraltar 2pm 6th March.
Other	5	9	The 180 cm thick concrete shield starts at the radius of 600 cm.
Product-Producer-Inv	16	22	Today's story of patent insanity comes to us courtesy of Wysong, a small natural pet foods company that came up with a method to put probiotics in foods in the early 80s.
Entity-Destination	4	8	AT&T inserted a new chip into their latest modem.
Entity-Destination	1	6	Many archaeologists have fallen into a trap while working to solve the secret of this pyramid.
Other	1	3	The manor had lands in Old Thame, Moreton and North Weston and property in New Thame.
Other	2	7	The trapped mass takes part in the movement and therefore contributes to the inertia of the system.
Member-Collection-Inv	10	12	They raided a house behind Mustapha's residence and seized a cache of arms, weapons and explosives.
Product-Producer	17	18	Because the ice in the smoothie has to be crushed and blended with the other ingredients, a smoothie maker is usually the appliance of choice.
Product-Producer	11	12	We even heard from descendants of Gustav Schoenike who was the violin maker.
Instrument-Agency	1	6	The broadsword was used in some units, particularly Scottish regiments.
Other	17	20	Lycophytes are vascular plants in the class Lycopodiopsida, a division of vascular plants known as Pteridophytes (the ferns and their allies).
Product-Producer	9	10	He also went on to found NeXT Inc., a computer company that built machines with futuristic designs.
