Cause-Effect	0	10	 Diabetes mellitus is one of the leading causes of irreversible blindness worldwide, and, in the United States.
Product-Producer	1	16	The church, is a stunning onion-domed, golden-filigreed, jewel of a building built (1903-1912) by the Russian aristocracy.
Entity-Destination	1	6	The team journeyed into an uncharted area.
Other	2	6	"A makeup artist applies the finishing touches to Marquesa Lawrence before the taping of a segment of ""The Scholar."""
Entity-Destination	3	10	Four deployed Holloman airmen ran into their former Holloman command chief recently.
Cause-Effect-Inv	18	21	Anthony finds inspiration in a beautiful, enigmatic older woman who teaches him to follow his heart and find happiness through swing dancing.
Member-Collection-Inv	3	6	Scattered among this streak of Celtic tigers are billions of euro loaned by Anglo Irish Bank over the past decade in a calculated play for lucrative returns.
Member-Collection-Inv	4	6	Individuals were granted a wrack of rabbits and some help building a rabbit run in their backyard to start up a small rabbit farm (--40 rabbits and a hutch, perhaps?), along with automatic membership in a cooperative rabbit abatoir.
Cause-Effect-Inv	4	8	In relation to the catastrophe caused by the rains of recent days in the Sierra and Coastal zones of Chiapas.
Entity-Destination	3	6	He put a gallon into his cart and walked back to the front of the store.
Message-Topic-Inv	11	17	They respond directly to these current vacancies mentioning the job code reference on the subject of the mail.
Entity-Origin	2	7	A social ride departs from the Cleveland library and heads for Carbrook where it Splits into 2 groups.
Member-Collection-Inv	3	7	It was a cloud of shrieking black bats that was attacking them.
Content-Container	1	6	The cocaine was concealed inside a teddy bear.
Member-Collection-Inv	22	24	Such an uneasy state of affairs existed until the fifth century, when the empire's Rhine barrier was breached, allowing a vast, mixed horde of barbarians to stream into Italy, thereby laying the groundwork for the kingdoms that would eventually come to dominate the European continent.
Instrument-Agency-Inv	4	9	In that case, the doctor stops the bleeding with hormones.
Cause-Effect	1	3	The product emits radiation.
Cause-Effect	0	7	 Properties of the soils developed from the amphibolites of Santiago-Ponte Ulla, Spain.
Member-Collection-Inv	3	6	We have a congress of different nations and congress within nations and some sports congress.
Entity-Origin	2	17	"A first edition of Charles Darwin's seminal ""The Origin of Species"", which was found in a family's toilet in southern Britain, will be sold this week."
Content-Container-Inv	14	17	U.S. Customs and Border Protection officers stopped a drug-smuggling attempt when they seized a suitcase full of marijuana.
Entity-Destination	1	5	The epidemic is spreading into areas and countries where, until recently, there was little or no HIV present.
Product-Producer	11	15	British scientists are fighting climate change by reducing the harmful greenhouse gases produced by flatulent cows.
Component-Whole-Inv	1	6	The exhibition comprises more than sixty works of art from international public and private collections.
Entity-Destination	2	6	The tonneau cover retracts into a canister.
Entity-Origin-Inv	5	9	Not too long ago, the grass was farmed for hay; then, it was ditched for mosquito control.
Other	16	20	Flowers are reborn from the soil and the climate begins to warm, all set to a score improvised by an orchestra of birds.
Instrument-Agency-Inv	1	8	A ceramist bakes the porcelain in a tin foil and further heats it by placing it an oven.
Other	16	19	Although Harry noticed it during exercise, the change that was identified was the difference in muscular discomfort from the beginning of his training program (riding five miles per day) to his current status two months later.
Message-Topic	3	5	Students write a paragraph stating reasons for doing something, and then a paragraph about how to do something.
Message-Topic	1	5	This statement pointed toward the resolution preferred by the Bosnian Serbs.
Instrument-Agency-Inv	5	8	This usage is uncommon among players of the instrument.
Other	0	10	 Unificationists sees Kingdom coming with the help of the new president.
Entity-Destination	4	7	CSU Stanislaus students take complaints to President's door.
Member-Collection-Inv	9	11	The structure of the benthic boundary layer over a bed of mussels (Mytilus edulis) was investigated in a large racetrack flume.
Message-Topic	1	4	"The novel examined the life of Larry Weller, an ""ordinary man made extraordinary"" by his unique talent for creating labyrinths."
Member-Collection-Inv	15	18	Little did these naive people realize at the time that they were embracing a foul brood of ungrateful vipers, which would soon prove to be their undoing.
Entity-Origin	3	7	After the distraught cub runs away from home, a mischievous storyteller called Bonifacio sweet-talks him into performing on stage.
Other	5	7	The spreading riots threw the country into turmoil.
Cause-Effect	1	7	The protest resulted in hours of traffic jams on Guangzhou's major roads, such as Guangyuanxi Lu, Huangshidong Lu and Dongfeng Lu.
Product-Producer-Inv	7	12	In addition to the landscape display, the students have assembled a window display with the assistance of Fortuna Energy Inc.
Component-Whole-Inv	6	11	A two zone alarm means the alarm has two seperate 'detection' circuits and can identify which circuit was triggered.
Other	3	7	When the great union of the popular masses of France opposed the great union of the adherents of the monarchy and the victory of 'political reform' had been attained, many countries followed the French example and undertook all sorts of 'political reforms'.
Component-Whole	10	14	Thus the leaves situated in the middle part of the stem of the sunflower plant show the highest amounts of endogenous cytokinin-like substances.
Entity-Destination	1	6	An object has been placed into orbit.
Component-Whole	1	4	The crust of the planet was flooded with melt and the crater tended to erase itself.
Other	1	6	The sense was extended from the language to the people who spoke it.
Member-Collection-Inv	6	9	Bella Strings is a professional string ensemble of passionate musicians performing in the greater Orlando area and across Central Florida.
Cause-Effect	0	1	 Fatigue corrosion and stress corrosion are similar, as both are caused by external stresses applied to the pipe and occur inside of the pipe.
Product-Producer-Inv	3	8	So when the plants came up and bore grain, then the weeds appeared also.
Member-Collection-Inv	5	7	The farm takes on the raffle of turkeys in July, when they're just one day old, until they're slaughtered in December.
Cause-Effect-Inv	1	7	The disruption caused by the latest Christmas terrorist has added too much to the weary trip home.
Entity-Origin	1	9	Colonial families of the United States descended from the immigrants who arrived before 1700.
Other	22	27	A University of Washington system named Hubble looks for these black holes and maps them on a Web site, providing an ever-changing constellation of the Internet's weak points.
Message-Topic	5	10	So, the theme of the play has to do with religion.
Product-Producer-Inv	1	4	The watchmaker makes the watch, he winds it up, he sets it going, he is outside the process but he initiates the process, he sets the hands in motion.
Other	1	6	The food is kept in the kitchen and guests help themselves as it is a self service.
Instrument-Agency-Inv	0	5	 Employees increasingly are turning to medication - and away from therapy - to treat depression.
Entity-Origin	8	12	The drama unfolded even after some of the stars had left the course.
Message-Topic-Inv	1	7	The scheme is illustrated with the following example.
Entity-Origin	4	8	The biggest political sex scandal came from a democrat.
Entity-Destination	3	7	Zook took the ax to the coaching staff.
Cause-Effect	1	5	The filament emits a yellowish-white light, and the walls have a strong yellow tint.
Entity-Destination	0	6	 Wave crests are blown into the froth.
Product-Producer-Inv	15	21	"This science-fiction thriller by a Seattle author is the story of Jane Charlotte, a young woman who tells her increasingly surreal tale of murder, kidnapping and an evil tribe of ""bad monkeys"" who are trying to control her actions to a skeptical psychiatrist."
Message-Topic-Inv	2	15	Another important data structure - the heap - has already been introduced in the previous chapter.
Entity-Destination	12	15	"When his pullets got ready to start laying, he placed the fake egg in a nest box, thus giving them the idea that the boxes were ""the place"" to lay their eggs."
Other	1	13	The achievements of Michael Phelps in the pool proved to be a major talking point for the riders.
Message-Topic	4	7	The point of the article is that food forms an important part of CNY.
Other	7	12	In the case of aerodynamic lift, the aircraft is kept in the air by wings or rotors (see aerodynamics).
Component-Whole	15	18	In this article most of the photos are taken with the fish oriented with the head of the fish pointing away from you and and turned upside down.
Other	27	30	This year's newest attractions include a dedicated music zone which takes you on a musical journey around the world and gives you a chance to experience musical ecstasy from different cultures.
Other	1	8	This view from the inside is from the bridge that spans Atherton Street.
Other	3	5	He put the posts in chronological order.
Content-Container	9	12	It was a jigsaw puzzle game of several spilled pecans in a dish.
Product-Producer	3	6	It is a scrawl by an artist to portray that which cannot be portrayed even on a canvas as big and large as the heavens.
Other	0	4	 Producers planted the frozen scallops that led to Spike's elimination from Top Chef.
Entity-Origin	4	9	They show that substantial intelligence was gained from pocket litter (materials found on detainees when they were captured).
Message-Topic	2	7	The Billboard charts tabulate the relative weekly popularity of songs or albums in the United States.
Entity-Origin	1	7	The pain was radiating from the right buttock to the knee joint.
Other	0	6	 Picric acid is kept in an aqueous solution, which makes it suitable and safe to handle.
Component-Whole-Inv	1	6	The mouse has left and right buttons on top, 4-Direction scroll ball between them.
Entity-Destination	3	8	The CFA program curriculum is shipped to the people.
Component-Whole-Inv	1	9	My dog has a little red ball on his snout.
Cause-Effect-Inv	5	7	Thatch is caused by excessive growth from overfertilizing, by allowing the grass to get too high before mowing, or by incorrect watering.
Other	0	3	 Batteries stored in contact with one another generate heat and hydrogen gas.
Message-Topic	4	8	We have provided detailed instructions setting out each step you need to follow in order to carry out your own DNA sample collection.
Instrument-Agency-Inv	7	8	Putting a first time learner in the driver's seat of a car is a scary proposition.
Other	9	10	This was meant to represent the resting of the maize spirits until the next harvesting period came around.
Product-Producer-Inv	1	6	The company has made available its collection of luxurious full black parts.
Content-Container	1	9	"The packet of corn tortillas, which was inside a box, said ""contains wheat""."
Cause-Effect-Inv	3	8	Most of the steam comes from a volcano's magma.
Other	7	13	Police charge a Carlisle man with eight offences in relation to the illegal trade of endangered tortoises.
Instrument-Agency-Inv	1	6	Maddie's parents killed her with sleeping pills.
Entity-Destination	1	11	Only part of the food energy is passed on to another consumer.
Other	1	6	This publication is supported by a grant from Merck.
Component-Whole	11	14	The engine operated three strands of rope fall, hoisting from the hold of the boat three tubs of iron ore at a time.
Instrument-Agency-Inv	6	10	And so I was in the group that took the taxi to the restaurant and then back again to the end of the race.
Cause-Effect	9	10	There are many types and causes of headaches, from tension headaches due to stress to migraines triggered by certain foods.
Entity-Origin	1	6	The bleeding usually originates from an artery in the back part of the nose.
Cause-Effect	2	4	And these gases cause evaporation of water from sea and soil.
Product-Producer-Inv	7	15	We think that's a case where the builder has targeted the market with the right product and has priced it well.
Member-Collection-Inv	6	8	Lake Oswego was home to a sord of mallards who fled south during January and February, and returned in March for breeding.
Message-Topic	1	5	Local legend tells of a man unjustly hanged and a grave where no grass will grow.
Component-Whole-Inv	1	5	California law consists of 29 codes, covering various subject areas, the State Constitution and Statutes.
Member-Collection-Inv	15	17	The calls of his caged decoy-birds have announced the arrival and passing over of a parcel of linnets.
Entity-Origin	0	3	" Remains from ancient epochs are discernible in the village vicinities - to the north of the village, in the location of ""Gradishteto"", lie the ruins of a Thracian and late antique fortresses, Thracian mounds and objects, bearing witness to ancient metallurgy."
Entity-Destination	3	6	Then, I put candy in my jar.
Product-Producer	7	8	Alex's skills as an editor and a documentary maker allowed us to be able to shoot it and turn it in that short amount of time.
Entity-Origin	5	10	Under the circumstance that the wife comes from a wealthy family, her dissatisfactions with her marriage may make her seem like a spoiled brat.
Component-Whole	2	5	The medical team of the army has undertaken a vaccination drive to prevent outbreak of any epidemic.
Cause-Effect-Inv	14	16	Initiated during the early 1990's National Mineral Resource Assessment, this project received a major boost from funding provided through the 'Data-at-Risk' add-on funding received by the USGS through the 2004 fiscal year.
Member-Collection-Inv	5	7	I once had a mixed orchard of plums, sweet cherries, apricots, tart cherries, peaches and apples.
Product-Producer-Inv	3	11	In September, an executive worked with Goofy Boi to create this video to support a current promotion.
Entity-Destination	2	7	Sufficient coagulation-deficient fluids were given to surgical patients.
Other	3	12	Erikson(1976) found that people from among a community who escaped an horrific accident had made little progress after two years.
Component-Whole-Inv	1	6	The exhibition brings together rare Chinese ceramics and paintings.
Content-Container	1	5	The hairdryer was in the desk drawer.
Product-Producer-Inv	9	13	It is in the hours of darkness that the plant builds up the oxidase that is to call out the signal that the flower has run its full course.
Other	5	9	Two extra-time goals sent the team into the Carling final.
Content-Container	4	5	My chihuahua ate a tea bag of green tea within the last two hours.
Product-Producer-Inv	13	15	Virtually all hillside farmers grow maize during both seasons, and many of the farmers cultivate beans, rice, and other crops as well.
Cause-Effect	1	4	The construction gives a refinement of Nori's argument in the case of a self-product of a curve.
Other	9	10	Old nests are used year after year by the carpenter bee.
Member-Collection-Inv	8	10	The very famous Elite agency chose among a pleiad of beauties, the prizes winner of the contest Elite Model World.
Entity-Origin	7	10	This incident was an incursion of illegal aliens from outer space and not U.S. military high-tech black project flying objects.
Entity-Destination	6	9	Previous custodians of the submarine poured concrete into the hull in a misguided attempt to retain the vessel's overall structure.
Message-Topic	4	7	The rest of the paragraph talks about attitude rather than syntax.
Entity-Origin	1	5	"The photograph was from the scene of the play's climax, where the character formerly known as Shylock threatens Antonio with a knife while demanding his ""pound of coins""."
Entity-Destination	4	8	I even placed the dish in a cold oven as directions state.
Entity-Destination	1	7	Real-world truths were imported into the fictional world.
Entity-Destination	1	8	The garbage was thrown into the waste disposal bin.
Cause-Effect-Inv	1	5	The instability grows from an perturbation whose initial amplitude is small.
Entity-Destination	1	5	The sinus rinse went into ear canal.
Content-Container	1	5	The stamp was inside a box for a double pack.
Product-Producer-Inv	8	14	Vinton (Vint) Cerf, along with Robert Kahn, is co-designer of the TCP/IP Internet network protocol.
Instrument-Agency-Inv	3	10	Further left a boy is fighting a peacock with a stick, and to the right a boy is killing an attacking goat with a spear.
Entity-Destination	2	6	The board meeting is rescheduled to next month.
Content-Container	1	5	The pepper was in a bottle, and the roll of butter was made around it.
Entity-Destination	9	13	Trench pudding is made from broken biscuits, condensed milk, jam put into a canteen and cooked over a little spirit stove.
Other	5	7	Rama Revealed (1993) is a science fiction novel by Arthur C. Clarke and Gentry Lee.
Component-Whole	16	19	The Foundation decided to repurpose the building in order to reduce wear and tear on the plumbing in the manor house by redirecting visitors during restoration projects and beyond.
Entity-Origin-Inv	1	2	Canned peach syrup was cooked for three minutes with a half-glass of raspberry jelly, this for color and to give a peach-melba flavor.
Cause-Effect-Inv	7	13	The tsunami was generated by an undersea landslide, which was triggered by the earthquake.
Other	4	7	Data shows that public concern about the economy has moved into the top five issues facing the country.
Message-Topic	5	11	At the heart of the discussion was the financial and artistic crisis that photojournalism is currently going through.
Product-Producer	1	5	The defamation comes from a bishop.
Cause-Effect-Inv	1	5	The revolution brought forth impassioned pleas condemning the common law for not respecting the interests of the people and calling for law reform.
Entity-Destination	1	8	The carrier polymers are migrating into the target organs.
Entity-Origin	1	5	The crowd departs from the capital after the swearining of President Barack Obama.
Other	1	7	The man has journeyed into deeper level studies with sound masters.
Entity-Destination	3	6	We sent the string to the webserver.
Instrument-Agency-Inv	11	14	Transient reduced electronic dynamics at low temperatures has been attempted by researchers using QDT approaches.
Cause-Effect-Inv	7	12	Our country is resolving the war and poverty caused by the previous administration.
Entity-Destination	3	7	Nielsen released his insights into the online industry.
Other	2	6	Our political prisoner is falling into oblivion.
Cause-Effect-Inv	5	8	We explore the experience of grief after the loss of a parent and offers support; we also make simple suggestions, and we provide a place for sharing memories.
Message-Topic	3	6	A short introductory chapter furnishes the background information.
Entity-Destination	5	9	He drags and drops the file icon into a folder.
Component-Whole-Inv	5	8	I made two pairs of jeans with regular zippers, which both quickly tore out.
Member-Collection-Inv	6	8	I had to battle through an aurora of polar bears to get to the station, where all the trains were cancelled and the one that I finally got took 37 hours to get to London, where there is no snow and it is about 20C like a summer day.
Entity-Destination	4	6	We poured the molten aluminium into ingots, which was very dangerous.
Component-Whole-Inv	3	4	Specifications of electric heater thermostats include temperature ranging from 50 degrees F to 80 degrees F, current ranging from 19 A to 22 A, & voltage ranging from 120 V to 277 V.
Component-Whole	4	7	The upper and lower steps of the stairs inside university buildings are clearly marked and are all equipped with at least one handrail.
Entity-Destination	1	6	A copy was sent to your e-mail address.
Member-Collection	3	6	He was a corporal in the army of Sierra Leone, a wedding photographer and cameraman for the State television.
Component-Whole-Inv	7	8	The device is the best solution for headphone cable knots on your MP3 player.
Content-Container-Inv	18	21	The mechanism whereby air enters the skull could perhaps be compared to that in which air enters a bottle full of liquid.
Component-Whole	1	5	The lid of the anthropoid coffin of Khonstefnakht dates from the 4th century BC.
Message-Topic	10	15	James P. Gorman greeted his employees on Tuesday with a memorandum that outlined the management changes at the firm.
Message-Topic	2	5	The pertinent passage describes the flag as a tricolor consisting of green, white and orange bands.
Instrument-Agency-Inv	3	9	A qualified medical professional uses a variety of diagnostic tests.
Component-Whole-Inv	1	5	The clock has one brass bar attached to a chain on each side of the pendulum.
Component-Whole	2	13	The local group, which has over 5000 members, is part of a national association of active and retired law enforcement officers.
Entity-Origin	1	5	The image is from the poster 'Selling Counterfeit Products is Illegal'.
Message-Topic	4	10	It is a 2004 book criticizing the political and linguistic writings of Noam Chomsky.
Member-Collection-Inv	3	5	Like magic, a covert of coots arrives to feed on whatever there is in the lake bottom.
Entity-Origin	3	7	The coordinating colorful strap is made from polyurethane.
Content-Container	6	12	When I opened the box, the cheesecake was inside a silver foil container.
Other	7	10	This ordinance was a result of the bond of profit agents getting angry over the recent expansion of the Broward County Pretrial program.
Other	5	13	Ji-Sung finds Jae-Young, but the striker blasts over the bar with only the keeper to beat.
Message-Topic	4	10	The purpose of this report is to present an unusual case of hepatic abscess due to infestation by Endamoeba histolytica.
Entity-Origin	5	10	The halogen combines with the tungsten evaporated from the hot filament to form a compound that is attracted back to the filament, thus extending the filament's life.
Entity-Destination	3	7	The new product's release is postponed to next month.
Cause-Effect-Inv	1	5	The radiation from the atomic bomb explosion is a typical acute radiation.
Cause-Effect	17	20	Like normal 'Simon' games, it starts with a one digit sequence, and then increases indefinitely until the caller makes a mistake.
Instrument-Agency	9	12	The event featured a demonstration of weaving on a loom by local weaver Nancy Alexander.
Cause-Effect	1	3	The cathode emits electrons.
Cause-Effect	12	15	Like a catch-22 the worst part is that acne causes stress and stress triggers acne breakouts.
Entity-Origin	6	12	It was probable that the Mn atom went away from an interstitial site neighboring on the substitutional Pt atom after the dissociation of the Pt.Mn complex.
Component-Whole-Inv	0	8	 Cruisers and large yachts have much more sophisticated fittings that that require more skills.
Product-Producer	2	8	The theme song was written by the songwriting team of Jay Livingston and Ray Evans.
Product-Producer	1	6	The music was composed by a musician who was not known outside his village.
Other	7	10	Retailers have done their bit to put wine in the hands of the masses, to make it more accessible to the wider UK public.
Instrument-Agency-Inv	1	7	This user plays games on a portable console.
Entity-Origin	18	22	There's a phrase of Sickert's where he speaks somewhere about something succeeding in that it is like a page torn from the book of life.
Other	9	14	Man gets life sentence in kidnap, ransom case of woman he kept in makeshift casket.
Entity-Destination	6	10	The bride and the groom poured champagne into stacked champagne glasses.
Component-Whole-Inv	1	4	The horse stretches its nuzzle towards the boy.
Other	7	10	While he was freeing himself from the clutches of the dishwasher, he ripped off some of his skin, revealing his bionic arm.
Entity-Destination	0	5	 Toxins are drained into the sea.
Member-Collection-Inv	1	3	A lamentation of swans is swimming on the lake, some are on the shore, and others are flying.
Other	1	6	The patient is kept in the hospital one night for observation.
Entity-Origin	8	11	It's fairly rare that I follow an exact recipe from a magazine, but every once in a while a photo calls to me.
Message-Topic	7	13	The Halsey Institute has put together a symposium with intent to discuss the dissemination of difficult imagery.
Entity-Origin	5	12	Pioneering percussionist Terje Isungset plays instruments made from a 2500 year old glacier.
Component-Whole-Inv	1	6	This oven has a flat belt conveyor with three zones and complete controls.
Message-Topic	4	11	In the 1950s, several books were published on the topic of sociometrics.
Member-Collection-Inv	13	16	Standing squarely in the way of progressive plans to fortify Marseilles, that magic grove of dodonian oaks, holly oaks and alder just had to go.
Component-Whole-Inv	1	5	The sail had an important roach and had adjustable batten fittings on the leech and luff receptacles.
Content-Container	2	8	The Skinner box was inside a large wooden icebox.
Component-Whole-Inv	2	4	For the satellite with rotors, one must include the effects of p as well; this modification, consistent with (2.2), is given in (4.3).
Component-Whole	5	8	When he clicked on the plug of the antenna and it automatically attached to the wires of the bulb socket.
Other	5	10	A cutting tool of the sort used for deep hole drilling has a cutting head mounted on a shank.
Product-Producer	9	10	It is also illegal for anyone other than the drug's manufacturer to re-import a prescription drug that was originally manufactured in the United States.
Entity-Origin-Inv	0	1	 Orange juice is a popular breakfast beverage made from the extraction (squeezing) of liquid from fresh oranges.
